"Flickr album title","Commons categories"
"Goddard Employees Hold Memorial Day Remembrance","Goddard Space Flight Center in 2017"
"NASA Commercialization Training Camp","Goddard Space Flight Center in 2019"
"2018 Goddard Memorial Symposium","Goddard Space Flight Center in 2018"
"STEM at Goddard","STEM at Goddard Space Flight Center"
"Goddard Takes a Selfie in JWST","James Webb Space Telescope"
"NASA Ground Antennas","Satellite ground stations"
"#PictureEarth from Goddard",
"Hurricane Lane","Hurricane Lane (2018)"
"Dr. Nancy Grace Roman","Nancy Roman"
"Sustaining Women in STEM 2019","STEM at Goddard Space Flight Center ;Goddard Space Flight Center in 2019"
"Parker Solar Probe Gets Visit From Namesake","Parker Solar Probe"
"GLOBE 2016","STEM at Goddard Space Flight Center"
"Cosmic Designs: at the Intersection of Imagery, Music and Space","Cosmic Designs: at the Intersection of Imagery, Music and Space"
"National Air and Space Museum (NASM) Event 2016","National Air and Space Museum;Goddard Space Flight Center in 2016"
"Goddard Center Locations",
"NASA Goddard Rolls Out 10 OPSPARC winners","Goddard Space Flight Center OPSPARC"
"2019 Patent Innovation Entrepreneurship Rapid Research (PIERR) program","STEM at Goddard Space Flight Center"
"NASA Goddard Visitor Center - 2017","Goddard Space Flight Center Visitor Center"
"Space Station Downlink","STEM at Goddard Space Flight Center"
"OPSPARC 2019 Winners","Goddard Space Flight Center OPSPARC"
"GRIPS Eyes the Sun During Antarctic Summer","Gamma-Ray Imager - Polarimeter for Solar flares (GRIPS)"
"Maryland Day 2016","Goddard Space Flight Center in 2016"
"Parker Solar Probe","Parker Solar Probe"
"NASA Goddard Library Wins Federal Award","Goddard Space Flight Center in 2016"
"Goddard’s Library Reopens as the Goddard Information and Collaboration Center","Goddard Space Flight Center in 2016"
"Piers Sellers - Distinguished Service Award","Piers Sellers"
"Parker Solar Probe Families and Friends Day","Parker Solar Probe"
"STEM Girls Night In","STEM at Goddard Space Flight Center"
"STEM Girls Night In 2018","STEM at Goddard Space Flight Center ;Goddard Space Flight Center in 2018"
"2017 Solar Eclipse Viewing at NASA","Solar eclipse of 2017 August 21"
"EXPORTS Ocean Expedition","EXport Processes in the Ocean from Remote Sensing (EXPORTS)"
"Goddard 2018","Goddard Space Flight Center in 2018"
"NASA 60th Anniversary celebration at NASA Goddard Space Flight Center","Goddard Space Flight Center in 2018"
"OPSPARC 2018","Goddard Space Flight Center OPSPARC"
"Piers Sellers","Piers Sellers"
"Rep. Steny Hoyer visits Goddard - June 2016","Goddard Space Flight Center in 2016"
"NASA Surveys Hurricane Damage to Puerto Rico’s Forests","Effects of Hurricane Maria in Puerto Rico"
"Arianespace Visits NASA Goddard","Arianespace Visits NASA Goddard"
"2016 Optimus Prime Challenge","Goddard Space Flight Center OPSPARC"
"Lightfoot, Roe All Hands 2016","Robert M. Lightfoot, Jr.;Goddard Space Flight Center in 2016"
"Goddard Remembers Craig R. Tooley","Goddard Space Flight Center in 2017"
"Sen. Ben Cardin Visits Goddard","Goddard Space Flight Center in 2016"
"Rep. Steny Hoyer Visits NASA Goddard Feb 2018","Goddard Space Flight Center in 2018"
"7-Year-Old Science Enthusiast Tours Goddard","STEM at Goddard Space Flight Center"
"Amazon Lidar","Amazon Rainforest"
"Film and Video Locations at Goddard - 2016","Goddard Space Flight Center in 2016"
